number,value,datetime_start,datetime_complete,duration,params_bagging_temperature,params_bootstrap_type,params_border_count,params_depth,params_l2_leaf_reg,params_learning_rate,params_min_data_in_leaf,params_random_strength,params_scale_pos_weight,params_subsample,user_attrs_best_iteration,user_attrs_f1,user_attrs_f2,user_attrs_precision,user_attrs_recall,user_attrs_roc_auc,user_attrs_threshold,state
0,0.7121797730352477,2026-02-25 13:07:56.311357,2026-02-25 13:08:23.125838,0 days 00:00:26.814481,1.416145155592091,Bayesian,93,5,5.100627805979912,0.13125830316209655,16,5.986584841970366,1.116167224336399,,1163,0.6423168614062454,0.7840206926282511,0.49362164118338914,0.9192148934377896,0.820081438814054,0.17829125633927861,COMPLETE
1,0.7132480265229678,2026-02-25 13:08:23.127392,2026-02-25 13:08:50.134304,0 days 00:00:27.006912,0.5824582803960838,Bayesian,99,4,11.999975480350798,0.13826189316223852,19,2.1233911067827616,1.6084844859190754,,1405,0.6388380537400146,0.7850024272537766,0.4875410126806775,0.9262909611658664,0.8211482433065365,0.22691764020490507,COMPLETE
2,0.6975288626429947,2026-02-25 13:08:50.136218,2026-02-25 13:10:19.579873,0 days 00:01:29.443655,,MVS,214,7,0.12040216379191711,0.01459007452373112,46,3.663618432936917,1.3993475643167195,0.6185801650879991,3969,0.6388119512051388,0.779284266221909,0.49123125028322834,0.9131496925280095,0.8116911000529282,0.23838876216067176,COMPLETE
3,0.6989345770249897,2026-02-25 13:10:19.581355,2026-02-25 13:11:49.004664,0 days 00:01:29.423309,,MVS,219,7,0.017402990823522552,0.015869086642715014,97,9.488855372533333,1.6092275383467414,0.7760609974958406,3999,0.6486355513826211,0.7801253096313565,0.5063841861344935,0.9020301575267459,0.8126481316654631,0.28497664076769064,COMPLETE
4,0.6913511430356852,2026-02-25 13:11:49.006360,2026-02-25 13:12:52.362025,0 days 00:01:03.355665,,MVS,191,4,0.01340300279322701,0.03822726574649208,26,9.093204020787821,1.623422152178822,0.6739417822102108,3999,0.6401187824795843,0.7777681561020667,0.49431297009722985,0.9079268806334765,0.8081148653387997,0.2710903649346486,COMPLETE
5,0.7131236023254434,2026-02-25 13:12:52.363517,2026-02-25 13:13:30.557321,0 days 00:00:38.193804,0.6506606615265287,Bayesian,240,8,29.866092370009415,0.08158812228791566,60,8.948273504276488,1.176985004103839,,892,0.6480226831816147,0.785323649411152,0.5018027179439771,0.914497514952405,0.8211042997141224,0.19260234186330283,COMPLETE
6,0.711615063966287,2026-02-25 13:13:30.558695,2026-02-25 13:14:44.822175,0 days 00:01:14.263480,1.9737738732010346,Bayesian,168,5,11.627201204016838,0.02085120818436357,29,3.567533266935893,1.2818484499495253,,3997,0.6349847165349789,0.7831728101748445,0.48274652518963473,0.9274703057872126,0.8197598933003282,0.18930923278076975,COMPLETE
7,0.6974412532912524,2026-02-25 13:14:44.823731,2026-02-25 13:16:15.774694,0 days 00:01:30.950963,,MVS,203,7,0.010481565330759975,0.017128044242493735,71,8.154614284548341,2.5425406933718913,0.6463476238100518,3999,0.6433478702431448,0.7793345008756567,0.4984032952283982,0.907168730519754,0.8120682268223831,0.3684007440365889,COMPLETE
8,0.7013872841013038,2026-02-25 13:16:15.776290,2026-02-25 13:17:42.919073,0 days 00:01:27.142783,,MVS,126,8,0.16748729494641598,0.054082340576877566,32,0.6355835028602363,2.459212356676128,0.7888859700647797,3062,0.6380493502701124,0.7819433708379856,0.4882899794404219,0.920309999157611,0.8151493602579045,0.3301944001480656,COMPLETE
9,0.7128410577110033,2026-02-25 13:17:42.920458,2026-02-25 13:18:19.147137,0 days 00:00:36.226679,0.2157828539866089,Bayesian,158,4,6.518100832986183,0.06899870818520017,78,5.612771975694963,2.0454656587639883,,1954,0.6396765843585492,0.7855448882793302,0.4884950248756219,0.9263752000673912,0.8210460513270209,0.2728399480628362,COMPLETE
10,0.7112495311739319,2026-02-25 13:18:19.149155,2026-02-25 13:18:47.431531,0 days 00:00:28.282376,0.8876970652227818,Bayesian,71,5,1.3980176651167553,0.1250138965738544,2,0.1796187561481961,2.91954149189084,,1239,0.6416190057193136,0.7845584437941125,0.492170626349892,0.9214051048774324,0.8203991237952832,0.34895939235223816,COMPLETE
11,0.7136620476502847,2026-02-25 13:18:47.433197,2026-02-25 13:19:13.902941,0 days 00:00:26.469744,0.4357071676726746,Bayesian,247,8,36.69802426091174,0.08369046673242664,59,2.2261697040856316,1.883649092863644,,553,0.6356276470079807,0.7843206962259321,0.48301077152114896,0.9292393227192317,0.8211363653611159,0.2422791890901231,COMPLETE
12,0.7131364633518118,2026-02-25 13:19:13.904519,2026-02-25 13:19:45.970058,0 days 00:00:32.065539,0.15980451368601667,Bayesian,116,6,38.197219622195,0.10214061795432927,49,2.1350463430381605,1.9985170428229388,,1197,0.6422898158498559,0.7841883718591521,0.4934683361207793,0.9196360879454132,0.8212315651313582,0.2721603775544746,COMPLETE
13,0.71396099509582,2026-02-25 13:19:45.971904,2026-02-25 13:20:32.042517,0 days 00:00:46.070613,0.6200744542112029,Bayesian,138,6,1.5384872812807024,0.04025066733604184,6,2.219368922185515,1.9391178522711994,,1833,0.6495787990526726,0.785413948093374,0.5042353160197338,0.912644259118861,0.8213128165253697,0.2858455537004775,COMPLETE
14,0.7138100639208187,2026-02-25 13:20:32.043941,2026-02-25 13:21:53.888738,0 days 00:01:21.844797,0.5007352520199178,Bayesian,251,6,1.5154701488855005,0.0323694839124847,64,2.0048105207048037,2.001840809155353,,3473,0.6450735859093327,0.785733826726757,0.49683616333591296,0.919383371240839,0.821525177850307,0.27569332921328527,COMPLETE
15,0.7131848758412075,2026-02-25 13:21:53.890127,2026-02-25 13:23:14.451959,0 days 00:01:20.561832,1.1650217644880667,Bayesian,146,6,1.197319565330567,0.03435952399082595,88,3.8827067456726323,2.2812198149503313,,3405,0.6471656003570897,0.7854893235863504,0.5003220760099384,0.91601381517985,0.8209247529154079,0.30733646373125395,COMPLETE
16,0.7132846631515227,2026-02-25 13:23:14.453397,2026-02-25 13:24:22.128741,0 days 00:01:07.675344,0.907441241505329,Bayesian,183,6,0.3048111053597157,0.0267741115546911,1,1.3451462652164845,2.2146847629268995,,2810,0.6404225516516867,0.7851204189980109,0.4899316872795464,0.9243534664307977,0.8210802554847545,0.2861241847925923,COMPLETE
17,0.7111017374269816,2026-02-25 13:24:22.130188,2026-02-25 13:25:37.121427,0 days 00:01:14.991239,0.4654263916125474,Bayesian,137,5,2.4069993160933487,0.010411619333489852,39,6.872511320877261,1.8058874478196454,,3995,0.6368602063524176,0.7846013615518272,0.48473383194016717,0.9281442169994103,0.8201329512927948,0.24508423203795793,COMPLETE
18,0.7140802793797063,2026-02-25 13:25:37.122793,2026-02-25 13:26:14.937876,0 days 00:00:37.815083,0.06824162481084761,Bayesian,176,7,0.6723004099808229,0.056848289673483626,66,4.599862088745185,2.842207033498861,,1174,0.647044847044847,0.7861235800990142,0.499701821184458,0.9176143543088198,0.8211641379678225,0.34938121915446857,COMPLETE
19,0.7133858650310886,2026-02-25 13:26:14.939512,2026-02-25 13:26:50.901745,0 days 00:00:35.962233,0.06139003259064768,Bayesian,167,7,0.42941109028827545,0.057045993924823235,81,4.828155512726715,2.878440852783405,,1103,0.6454803933183272,0.7853467287429552,0.49773900333439913,0.9179513099149187,0.8210563954716675,0.3490629108621916,COMPLETE
20,0.7103304531353554,2026-02-25 13:26:50.903232,2026-02-25 13:27:19.687084,0 days 00:00:28.783852,1.433438152801837,Bayesian,110,7,0.03505220574579008,0.050593183768398726,13,4.485582852144914,2.66376732899109,,860,0.649042789413671,0.7843890976080303,0.5040783034257749,0.9110437199898913,0.8199736482614778,0.3524599550345312,COMPLETE
21,0.714391548375307,2026-02-25 13:27:19.688541,2026-02-25 13:28:35.316207,0 days 00:01:15.627666,0.3468052540632099,Bayesian,227,6,0.7511649655183991,0.028237169843526474,64,3.1003107329079946,2.2875755606734094,,3188,0.6470728224654926,0.7855089630068324,0.5001609565417338,0.9161822929828995,0.8216042907335787,0.3107896579654077,COMPLETE
22,0.713512010112347,2026-02-25 13:28:35.317887,2026-02-25 13:29:43.869277,0 days 00:01:08.551390,0.2643365543140507,Bayesian,227,6,0.5532092685638866,0.025765580402292355,55,3.061920694531145,2.720972004462601,,2840,0.6410923657203006,0.7851577047583579,0.4909538737124944,0.9235110774155505,0.8213435886536947,0.3300722170000987,COMPLETE
23,0.7130399619244494,2026-02-25 13:29:43.870794,2026-02-25 13:30:23.480038,0 days 00:00:39.609244,0.7401853379290175,Bayesian,184,7,0.10278639945367374,0.04269880927590896,75,2.7909956470796917,2.2178514368057893,,1248,0.6444680599834691,0.7854480565269323,0.4960690752101795,0.9195518490438884,0.8207043781822487,0.29511678679681747,COMPLETE
24,0.7145910773338269,2026-02-25 13:30:23.482006,2026-02-25 13:31:32.334920,0 days 00:01:08.852914,0.3199484315837708,Bayesian,144,6,2.8101381544610207,0.027504715273577205,66,7.002382971510138,2.3500437628674695,,2892,0.6428424607252973,0.7855830510420854,0.4934186801298233,0.9220790160896302,0.821448087341424,0.3037276981364445,COMPLETE
25,0.7140673754652394,2026-02-25 13:31:32.336977,2026-02-25 13:32:49.204913,0 days 00:01:16.867936,0.004792009463481128,Bayesian,155,5,3.0143615479585653,0.026618775312944643,68,7.3682313405868065,2.420604265345944,,3981,0.641173205573895,0.7856079262356108,0.4907871198568873,0.9244377053323225,0.8215798700622452,0.30752546562150784,COMPLETE
26,0.6978763947339407,2026-02-25 13:32:49.206463,2026-02-25 13:34:10.083441,0 days 00:01:20.876978,,MVS,199,6,0.7094485002363891,0.02062048527472376,84,6.016805105475799,2.7407911943108547,0.9760033421359315,3873,0.6463594497787677,0.7798971468417688,0.5028568752341701,0.9044730856709629,0.8124942590097329,0.39263016026226244,COMPLETE
27,0.7137191589233897,2026-02-25 13:34:10.084851,2026-02-25 13:35:58.342609,0 days 00:01:48.257758,0.29951186039854133,Bayesian,172,7,0.06220823273066528,0.011587522747984538,90,6.944295866368336,2.326615328992768,,3901,0.6514037835883841,0.7856530395733117,0.507010550996483,0.9107910032853171,0.821443714207102,0.32504188185890703,COMPLETE
28,0.7137727079896995,2026-02-25 13:35:58.344607,2026-02-25 13:37:10.347625,0 days 00:01:12.003018,0.34590307909563905,Bayesian,236,6,0.2062636471626572,0.031040681585914196,40,5.286161415509497,2.5848223307700766,,2992,0.6471164987966842,0.7860545690775227,0.4998622968879097,0.9173616376042456,0.821512771284254,0.33262143730406896,COMPLETE
29,0.7144259829742649,2026-02-25 13:37:10.349171,2026-02-25 13:38:13.928085,0 days 00:01:03.578914,0.016063093146534813,Bayesian,66,5,4.241164166907791,0.04642452650349349,68,6.196794741755697,2.109569085636627,,3060,0.6487309644670051,0.7860006077883739,0.5024746750543504,0.9150871872630781,0.8221110296755008,0.29670754685265993,COMPLETE
